{
 "id": "stats.counters",
 "title": "Stat counters row",
 "semantic": {
  "id": "stats.counters",
  "category": "STATS"
 },
 "source": {
  "id": "Stats:Stats:section@62",
  "file": "src/components/Stats.jsx",
  "tag": "section",
  "lines": "44-77",
  "tagLine": 62,
  "tagLineSha1": "cb214e18d7850ecb",
  "anchor": "export default function Stats",
  "anchorLine": 44
 },
 "additionalSources": [],
 "purpose": "Three headline platform numbers with short labels directly under the hero.",
 "retrievalEligible": true,
 "placement": "main",
 "variants": {
  "default": {
   "description": "single observed variant",
   "requiredFields": [
    "items"
   ],
   "forbiddenFields": [],
   "observedOn": [
    "/"
   ]
  }
 },
 "content": {
  "budgetRule": "Budgets are COUNTS measured from the rendered clone at 1440 and 390 (extraction/measured-values.json copyBudgetExtractor); copy itself is never stored. maxWords/maxChars = the maximum observed across every route that renders this section; list sizes = observed min/max. Shorter is allowed; longer is rejected.",
  "requiredFields": [
   "items"
  ],
  "fields": {
   "items[].title": {
    "type": "text",
    "maxWords": 2,
    "maxChars": 14,
    "observedIn": 1
   },
   "items[].text": {
    "type": "text",
    "maxWords": 3,
    "maxChars": 21,
    "observedIn": 1
   }
  },
  "listSizes": {
   "items": [
    3,
    3
   ]
  }
 },
 "assets": {
  "fields": {},
  "note": "reference mode may use referenceRoles (evidence); generated mode must use generatedRoles (generation-safe only, pinned in code). See assets/asset-roles.json."
 },
 "generatedAssetRoles": [],
 "style": {
  "props": {},
  "note": "token props take token-catalog names only (tokens/llm/token-catalog.json); allowed values per section are listed in tokens/llm/token-policy.json styleProps."
 },
 "constraints": {
  "maxPerPage": 1,
  "consecutiveVariants": []
 },
 "motion": {
  "allowedPatterns": [
   "static"
  ],
  "requiredPatterns": [],
  "reducedMotionFallback": {
   "static": "none-needed"
  }
 },
 "responsive": [
  {
   "range": ">=768",
   "behavior": "three numbers in a row"
  },
  {
   "range": "<=767",
   "behavior": "stacked; 222.5px at 390"
  }
 ],
 "runtimeUi": [],
 "measuredHeightsPx": {
  "1440": {
   "nodes": 1,
   "minPx": 183.4,
   "maxPx": 183.4,
   "medianPx": 183.4,
   "sample": {
    "/": 183.4
   }
  },
  "390": {
   "nodes": 1,
   "minPx": 222.5,
   "maxPx": 222.5,
   "medianPx": 222.5,
   "sample": {
    "/": 222.5
   }
  }
 },
 "evidence": [
  "src/components/Stats.jsx:44-77",
  "src/pages/Home.jsx:24"
 ]
}
