{
 "id": "features.compare-table",
 "title": "Comparison table",
 "semantic": {
  "id": "features.compare-table",
  "category": "FEATURES"
 },
 "source": {
  "id": "CompareTable:CompareTable:section@34",
  "file": "src/components/pages/payments/CompareTable.jsx",
  "tag": "section",
  "lines": "32-77",
  "tagLine": 34,
  "tagLineSha1": "28a37769fd84b118",
  "anchor": "export default function CompareTable",
  "anchorLine": 32
 },
 "additionalSources": [],
 "purpose": "Heading and a feature-by-feature table comparing the built-in checkout with alternatives.",
 "retrievalEligible": true,
 "placement": "main",
 "variants": {
  "default": {
   "description": "single observed variant",
   "requiredFields": [
    "actions",
    "heading",
    "items",
    "lead"
   ],
   "forbiddenFields": [],
   "observedOn": [
    "/payments"
   ]
  }
 },
 "content": {
  "budgetRule": "Budgets are COUNTS measured from the rendered clone at 1440 and 390 (extraction/measured-values.json copyBudgetExtractor); copy itself is never stored. maxWords/maxChars = the maximum observed across every route that renders this section; list sizes = observed min/max. Shorter is allowed; longer is rejected.",
  "requiredFields": [
   "actions",
   "heading",
   "items",
   "lead"
  ],
  "fields": {
   "heading": {
    "type": "text",
    "maxWords": 5,
    "maxChars": 26,
    "observedIn": 1,
    "maxLines1440": 1,
    "maxLines390": 2
   },
   "lead": {
    "type": "text",
    "maxWords": 2,
    "maxChars": 15,
    "observedIn": 1,
    "maxLines1440": 1,
    "maxLines390": 2
   },
   "items[].text": {
    "type": "text",
    "maxWords": 6,
    "maxChars": 53,
    "observedIn": 1
   },
   "actions[].label": {
    "type": "text",
    "maxWords": 3,
    "maxChars": 14,
    "observedIn": 1
   }
  },
  "listSizes": {
   "items": [
    11,
    11
   ],
   "actions": [
    1,
    1
   ]
  }
 },
 "assets": {
  "fields": {},
  "note": "reference mode may use referenceRoles (evidence); generated mode must use generatedRoles (generation-safe only, pinned in code). See assets/asset-roles.json."
 },
 "generatedAssetRoles": [],
 "style": {
  "props": {},
  "note": "token props take token-catalog names only (tokens/llm/token-catalog.json); allowed values per section are listed in tokens/llm/token-policy.json styleProps."
 },
 "constraints": {
  "maxPerPage": 1,
  "consecutiveVariants": []
 },
 "motion": {
  "allowedPatterns": [
   "static"
  ],
  "requiredPatterns": [],
  "reducedMotionFallback": {
   "static": "none-needed"
  }
 },
 "responsive": [
  {
   "range": "all",
   "behavior": "table scrolls/condenses on small screens"
  }
 ],
 "runtimeUi": [],
 "measuredHeightsPx": {
  "1440": {
   "nodes": 1,
   "minPx": 870.4,
   "maxPx": 870.4,
   "medianPx": 870.4,
   "sample": {
    "/payments": 870.4
   }
  },
  "390": {
   "nodes": 1,
   "minPx": 1183.4,
   "maxPx": 1183.4,
   "medianPx": 1183.4,
   "sample": {
    "/payments": 1183.4
   }
  }
 },
 "evidence": [
  "src/components/pages/payments/CompareTable.jsx:32-77",
  "src/pages/Payments.jsx:40"
 ]
}
