{
 "id": "hero.pricing",
 "title": "Pricing page heading block",
 "semantic": {
  "id": "hero.pricing",
  "category": "HERO"
 },
 "source": {
  "id": "PlanCards:PlanCards:div@194",
  "file": "src/components/pages/pricing/PlanCards.jsx",
  "tag": "div",
  "lines": "179-223",
  "tagLine": 194,
  "tagLineSha1": "9b283d70ec771e45",
  "anchor": "export default function PlanCards",
  "anchorLine": 179
 },
 "additionalSources": [],
 "purpose": "Page-opening heading and one-line intro of the pricing page (decomposed from the plan section: same DOM section, own semantic unit).",
 "retrievalEligible": true,
 "placement": "main",
 "variants": {
  "default": {
   "description": "single observed variant",
   "requiredFields": [
    "heading",
    "lead"
   ],
   "forbiddenFields": [],
   "observedOn": [
    "/pricing"
   ]
  }
 },
 "content": {
  "budgetRule": "Budgets are COUNTS measured from the rendered clone at 1440 and 390 (extraction/measured-values.json copyBudgetExtractor); copy itself is never stored. maxWords/maxChars = the maximum observed across every route that renders this section; list sizes = observed min/max. Shorter is allowed; longer is rejected.",
  "requiredFields": [
   "heading",
   "lead"
  ],
  "fields": {
   "heading": {
    "type": "text",
    "maxWords": 3,
    "maxChars": 17,
    "observedIn": 1,
    "maxLines1440": 1,
    "maxLines390": 1
   },
   "lead": {
    "type": "text",
    "maxWords": 9,
    "maxChars": 45,
    "observedIn": 1,
    "maxLines1440": 1,
    "maxLines390": 1
   }
  },
  "listSizes": {}
 },
 "assets": {
  "fields": {},
  "note": "reference mode may use referenceRoles (evidence); generated mode must use generatedRoles (generation-safe only, pinned in code). See assets/asset-roles.json."
 },
 "generatedAssetRoles": [],
 "style": {
  "props": {},
  "note": "token props take token-catalog names only (tokens/llm/token-catalog.json); allowed values per section are listed in tokens/llm/token-policy.json styleProps."
 },
 "constraints": {
  "maxPerPage": 1,
  "consecutiveVariants": []
 },
 "motion": {
  "allowedPatterns": [
   "static"
  ],
  "requiredPatterns": [],
  "reducedMotionFallback": {
   "static": "none-needed"
  }
 },
 "responsive": [
  {
   "range": "all",
   "behavior": "centred heading and intro"
  }
 ],
 "runtimeUi": [],
 "measuredHeightsPx": {
  "1440": {
   "nodes": 1,
   "minPx": 319.5,
   "maxPx": 319.5,
   "medianPx": 319.5,
   "sample": {
    "/pricing": 319.5
   }
  },
  "390": {
   "nodes": 1,
   "minPx": 210.3,
   "maxPx": 210.3,
   "medianPx": 210.3,
   "sample": {
    "/pricing": 210.3
   }
  }
 },
 "evidence": [
  "src/components/pages/pricing/PlanCards.jsx:179-223",
  "src/pages/Pricing.jsx:14"
 ]
}
