{
 "id": "pricing.fee-details",
 "title": "Fee details disclosures",
 "semantic": {
  "id": "pricing.fee-details",
  "category": "PRICING"
 },
 "source": {
  "id": "FeeDropdowns:FeeDropdowns:section@65",
  "file": "src/components/pages/pricing/FeeDropdowns.jsx",
  "tag": "section",
  "lines": "63-83",
  "tagLine": 65,
  "tagLineSha1": "a127bc51ea3fbd04",
  "anchor": "export default function FeeDropdowns",
  "anchorLine": 63
 },
 "additionalSources": [],
 "purpose": "Columns of click-to-open fee breakdowns with a note line.",
 "retrievalEligible": true,
 "placement": "main",
 "variants": {
  "default": {
   "description": "single observed variant",
   "requiredFields": [
    "actions",
    "heading",
    "lead"
   ],
   "forbiddenFields": [],
   "observedOn": [
    "/pricing"
   ]
  }
 },
 "content": {
  "budgetRule": "Budgets are COUNTS measured from the rendered clone at 1440 and 390 (extraction/measured-values.json copyBudgetExtractor); copy itself is never stored. maxWords/maxChars = the maximum observed across every route that renders this section; list sizes = observed min/max. Shorter is allowed; longer is rejected.",
  "requiredFields": [
   "actions",
   "heading",
   "lead"
  ],
  "fields": {
   "heading": {
    "type": "text",
    "maxWords": 5,
    "maxChars": 27,
    "observedIn": 1,
    "maxLines1440": 1,
    "maxLines390": 2
   },
   "lead": {
    "type": "text",
    "maxWords": 53,
    "maxChars": 308,
    "observedIn": 1,
    "maxLines1440": 3,
    "maxLines390": 8
   },
   "actions[].label": {
    "type": "text",
    "maxWords": 3,
    "maxChars": 15,
    "observedIn": 1
   }
  },
  "listSizes": {
   "actions": [
    5,
    5
   ]
  }
 },
 "assets": {
  "fields": {},
  "note": "reference mode may use referenceRoles (evidence); generated mode must use generatedRoles (generation-safe only, pinned in code). See assets/asset-roles.json."
 },
 "generatedAssetRoles": [],
 "style": {
  "props": {},
  "note": "token props take token-catalog names only (tokens/llm/token-catalog.json); allowed values per section are listed in tokens/llm/token-policy.json styleProps."
 },
 "constraints": {
  "maxPerPage": 1,
  "consecutiveVariants": []
 },
 "motion": {
  "allowedPatterns": [
   "disclosure.instant"
  ],
  "requiredPatterns": [
   "disclosure.instant"
  ],
  "reducedMotionFallback": {
   "disclosure.instant": "unchanged"
  }
 },
 "responsive": [
  {
   "range": ">=992",
   "behavior": "columns side by side"
  },
  {
   "range": "<=767",
   "behavior": "stacked"
  }
 ],
 "runtimeUi": [],
 "measuredHeightsPx": {
  "1440": {
   "nodes": 1,
   "minPx": 516.3,
   "maxPx": 516.3,
   "medianPx": 516.3,
   "sample": {
    "/pricing": 516.3
   }
  },
  "390": {
   "nodes": 1,
   "minPx": 545.1,
   "maxPx": 545.1,
   "medianPx": 545.1,
   "sample": {
    "/pricing": 545.1
   }
  }
 },
 "evidence": [
  "src/components/pages/pricing/FeeDropdowns.jsx:63-83",
  "src/pages/Pricing.jsx:16"
 ]
}
