{
 "id": "features.offer-cards",
 "title": "Offer / use-case cards",
 "semantic": {
  "id": "features.offer-cards",
  "category": "FEATURES"
 },
 "source": {
  "id": "Teach:Teach:section@96",
  "file": "src/components/Teach.jsx",
  "tag": "section",
  "lines": "51-138",
  "tagLine": 96,
  "tagLineSha1": "7e59890112e15a82",
  "anchor": "export default function Teach",
  "anchorLine": 51
 },
 "additionalSources": [
  {
   "id": "Teach:Teach:section@60#enterprise",
   "file": "src/components/Teach.jsx",
   "tag": "section",
   "lines": "51-138",
   "tagLine": 60,
   "tagLineSha1": "5153cc91951deba1",
   "anchor": "export default function Teach",
   "anchorLine": 51
  }
 ],
 "purpose": "Grid of image cards, one per thing the platform lets you offer (products or organisational use cases), each linking deeper.",
 "retrievalEligible": true,
 "placement": "main",
 "variants": {
  "enterprise": {
   "description": "four use-case cards, heading only",
   "requiredFields": [
    "heading",
    "items",
    "media"
   ],
   "forbiddenFields": [
    "actions",
    "lead"
   ],
   "observedOn": [
    "/enterprise"
   ]
  },
  "home": {
   "description": "homepage product cards with heading, paragraph and button",
   "requiredFields": [
    "actions",
    "heading",
    "items",
    "lead",
    "media"
   ],
   "forbiddenFields": [],
   "observedOn": [
    "/"
   ]
  }
 },
 "content": {
  "budgetRule": "Budgets are COUNTS measured from the rendered clone at 1440 and 390 (extraction/measured-values.json copyBudgetExtractor); copy itself is never stored. maxWords/maxChars = the maximum observed across every route that renders this section; list sizes = observed min/max. Shorter is allowed; longer is rejected.",
  "requiredFields": [
   "heading",
   "items",
   "media"
  ],
  "fields": {
   "heading": {
    "type": "text",
    "maxWords": 9,
    "maxChars": 46,
    "observedIn": 2,
    "maxLines1440": 2,
    "maxLines390": 3
   },
   "lead": {
    "type": "text",
    "maxWords": 27,
    "maxChars": 170,
    "observedIn": 1,
    "maxLines1440": 2,
    "maxLines390": 4
   },
   "items[].title": {
    "type": "text",
    "maxWords": 2,
    "maxChars": 20,
    "observedIn": 2
   },
   "items[].text": {
    "type": "text",
    "maxWords": 15,
    "maxChars": 103,
    "observedIn": 2
   },
   "actions[].label": {
    "type": "text",
    "maxWords": 3,
    "maxChars": 14,
    "observedIn": 1
   },
   "media[].alt": {
    "type": "text",
    "maxWords": 18,
    "maxChars": 114,
    "observedIn": 1
   }
  },
  "listSizes": {
   "items": [
    4,
    4
   ],
   "actions": [
    1,
    1
   ],
   "media": [
    4,
    4
   ]
  }
 },
 "assets": {
  "fields": {
   "media[]": {
    "type": "asset",
    "referenceRoles": [
     "photo.source-scene",
     "product.screenshot"
    ],
    "generatedRoles": [
     "photo.generated-scene",
     "product.generated-visual"
    ]
   }
  },
  "note": "reference mode may use referenceRoles (evidence); generated mode must use generatedRoles (generation-safe only, pinned in code). See assets/asset-roles.json."
 },
 "generatedAssetRoles": [
  "photo.generated-scene",
  "product.generated-visual"
 ],
 "style": {
  "props": {},
  "note": "token props take token-catalog names only (tokens/llm/token-catalog.json); allowed values per section are listed in tokens/llm/token-policy.json styleProps."
 },
 "constraints": {
  "maxPerPage": 1,
  "consecutiveVariants": []
 },
 "motion": {
  "allowedPatterns": [
   "static"
  ],
  "requiredPatterns": [],
  "reducedMotionFallback": {
   "static": "none-needed"
  }
 },
 "responsive": [
  {
   "range": ">=992",
   "behavior": "cards in a row"
  },
  {
   "range": "<=767",
   "behavior": "cards stack (home 2205px at 390)"
  }
 ],
 "runtimeUi": [],
 "measuredHeightsPx": {
  "1440": {
   "nodes": 2,
   "minPx": 626.8,
   "maxPx": 1055,
   "medianPx": 840.9,
   "sample": {
    "/": 1055,
    "/enterprise": 626.8
   }
  },
  "390": {
   "nodes": 2,
   "minPx": 1869.3,
   "maxPx": 2205.3,
   "medianPx": 2037.3,
   "sample": {
    "/": 2205.3,
    "/enterprise": 1869.3
   }
  }
 },
 "evidence": [
  "src/components/Teach.jsx:51-138",
  "src/pages/Home.jsx:26",
  "src/pages/Enterprise.jsx:26"
 ]
}
