{
 "id": "editorial.quick-links-slider",
 "title": "Resource quick-links slider",
 "semantic": {
  "id": "editorial.quick-links-slider",
  "category": "EDITORIAL"
 },
 "source": {
  "id": "QuickLinksSlider:QuickLinksSlider:section@23",
  "file": "src/components/sections/QuickLinksSlider.jsx",
  "tag": "section",
  "lines": "18-95",
  "tagLine": 23,
  "tagLineSha1": "0aa353647df71591",
  "anchor": "export default function QuickLinksSlider",
  "anchorLine": 18
 },
 "additionalSources": [],
 "purpose": "Header beside a looping slider of resource cards (image, title, text, uppercase link label) with prev / n of N / next.",
 "retrievalEligible": true,
 "placement": "main",
 "variants": {
  "default": {
   "description": "single observed variant",
   "requiredFields": [
    "actions",
    "heading",
    "items",
    "lead",
    "media"
   ],
   "forbiddenFields": [],
   "observedOn": [
    "/sales-and-marketing"
   ]
  }
 },
 "content": {
  "budgetRule": "Budgets are COUNTS measured from the rendered clone at 1440 and 390 (extraction/measured-values.json copyBudgetExtractor); copy itself is never stored. maxWords/maxChars = the maximum observed across every route that renders this section; list sizes = observed min/max. Shorter is allowed; longer is rejected.",
  "requiredFields": [
   "actions",
   "heading",
   "items",
   "lead",
   "media"
  ],
  "fields": {
   "heading": {
    "type": "text",
    "maxWords": 2,
    "maxChars": 11,
    "observedIn": 1,
    "maxLines1440": 1,
    "maxLines390": 1
   },
   "lead": {
    "type": "text",
    "maxWords": 8,
    "maxChars": 52,
    "observedIn": 1,
    "maxLines1440": 1,
    "maxLines390": 2
   },
   "items[].title": {
    "type": "text",
    "maxWords": 10,
    "maxChars": 58,
    "observedIn": 1
   },
   "items[].text": {
    "type": "text",
    "maxWords": 17,
    "maxChars": 95,
    "observedIn": 1
   },
   "actions[].label": {
    "type": "text",
    "maxWords": 2,
    "maxChars": 12,
    "observedIn": 1
   }
  },
  "listSizes": {
   "items": [
    5,
    5
   ],
   "actions": [
    2,
    2
   ],
   "media": [
    5,
    5
   ]
  }
 },
 "assets": {
  "fields": {
   "media[]": {
    "type": "asset",
    "referenceRoles": [
     "photo.source-scene",
     "product.screenshot"
    ],
    "generatedRoles": [
     "photo.generated-scene",
     "product.generated-visual"
    ]
   }
  },
  "note": "reference mode may use referenceRoles (evidence); generated mode must use generatedRoles (generation-safe only, pinned in code). See assets/asset-roles.json."
 },
 "generatedAssetRoles": [
  "photo.generated-scene",
  "product.generated-visual"
 ],
 "style": {
  "props": {},
  "note": "token props take token-catalog names only (tokens/llm/token-catalog.json); allowed values per section are listed in tokens/llm/token-policy.json styleProps."
 },
 "constraints": {
  "maxPerPage": 1,
  "consecutiveVariants": []
 },
 "motion": {
  "allowedPatterns": [
   "carousel.manual"
  ],
  "requiredPatterns": [
   "carousel.manual"
  ],
  "reducedMotionFallback": {
   "carousel.manual": "instant-slide"
  }
 },
 "responsive": [
  {
   "range": ">=992",
   "behavior": "controls over the text column"
  },
  {
   "range": "<=991",
   "behavior": "controls below the slides"
  }
 ],
 "runtimeUi": [],
 "measuredHeightsPx": {
  "1440": {
   "nodes": 1,
   "minPx": 818.4,
   "maxPx": 818.4,
   "medianPx": 818.4,
   "sample": {
    "/sales-and-marketing": 818.4
   }
  },
  "390": {
   "nodes": 1,
   "minPx": 921.2,
   "maxPx": 921.2,
   "medianPx": 921.2,
   "sample": {
    "/sales-and-marketing": 921.2
   }
  }
 },
 "evidence": [
  "src/components/sections/QuickLinksSlider.jsx:18-95",
  "src/pages/SalesAndMarketing.jsx:67"
 ]
}
